{
  "experiment_id": "EXP-DRAW-20260827-018-V2",
  "supersedes_experiment_id": "EXP-DRAW-20260827-018-V1",
  "research_domain": "DRAW",
  "lab_name": "RESIDUAL NEIGHBOR CLOSURE LAB",
  "research_name": "RESIDUAL NEIGHBOR EFFECT / ADJACENCY AXIS CLOSURE V2",
  "research_purpose": "Preserve EXP-018 V1 and clarify only the deterministic percentile target-round cluster bootstrap construction for U95_DELTA before any outcome access.",
  "hypothesis": "Within target and exact Return-age strata, Neighbor status has positive practically relevant residual association with T MAIN6 inclusion.",
  "counter_hypothesis": "Within fixed target and exact Return-age margins, Neighbor status provides no additional positive information.",
  "data_range": {"historical_start": 2, "historical_end": 1238, "development_start": 2, "development_end": 867, "holdout_start": 868, "holdout_end": 1238},
  "input_data": [{"path": "v27_storage/audits/current_1239_predraw_rerun_001/STAGING_CONTIGUOUS_DRAW_1_1238.csv", "fields": ["round", "n1", "n2", "n3", "n4", "n5", "n6"], "sha256": "1160cafab32542f28b9f2e7656ec4b471d01a3a521b8b35e21dc9ae9c953cce8"}],
  "calculation_method": {"matching": "unchanged exact (target, Return-age) strata", "primary": "unchanged exact DP convolution of conditional Hypergeometric distributions", "effect": "unchanged weighted DELTA_MATCH", "bootstrap": "target-round cluster percentile bootstrap", "replicates": 100000, "seed": 20260827, "rng": "Python random.Random independently initialized per split", "sampling": "ascending matched-round population with replacement via rng.randrange", "u95": "sort ascending and select zero-based index 94999 without interpolation"},
  "result_metrics": ["TOTAL_NEIGHBOR_HITS", "DELTA_MATCH", "EXACT_ONE_SIDED_P_PRIMARY", "U95_DELTA"],
  "success_criteria": ["both splits p_primary <= 0.05 and DELTA_MATCH >= 0.0100"],
  "failure_criteria": ["both splits U95_DELTA < 0.0100 closes only the locked ±1 axis", "one split positive only gives FAILED_NOT_REPRODUCED", "all other combinations are INCONCLUSIVE", "any invalid bootstrap replicate blocks execution"],
  "minimum_sample": null,
  "validation_windows": {"development": "2..867", "holdout": "868..1238"},
  "future_data_block": {"rule": "target T predictors use MAIN6 only through T-1", "registration_outcome_join": false, "future_leakage": 0},
  "walkforward_required": true,
  "random_null_required": true,
  "multiple_testing_risk": {"level": "LOW_BY_DESIGN", "control": "one formal question; all subgroups exploratory only"},
  "overfitting_risk": {"level": "CONTROLLED", "control": "V1 rules preserved; percentile order statistic and RNG fixed before outcomes"},
  "protocol_version": "V2-001",
  "canonical_protocol_hash": "a75bbe585f01be80ced3dd1252aad2f3b5de2e1b0d93e5db3d3ade73408c3127",
  "locked_at": "2026-08-27T19:55:27+09:00",
  "research_result": {"final_verdict": "AXIS_CLOSED_NO_PRACTICALLY_USEFUL_RESIDUAL_NEIGHBOR_EFFECT", "development_verdict": "NO_PRACTICALLY_USEFUL_EFFECT", "holdout_verdict": "NO_PRACTICALLY_USEFUL_EFFECT", "development_u95_delta": -0.005820557149569155, "holdout_u95_delta": 0.002524020616370079},
  "failure_reason": ["LOCKED_PRACTICAL_POSITIVE_EFFECT_THRESHOLD_EXCLUDED_IN_BOTH_SPLITS"],
  "reproducibility_status": "REPRODUCED",
  "status": "FAILED",
  "promotion_eligible": false,
  "official_effect": "NONE",
  "official_isolation_verified": true,
  "created_at": "2026-08-27T19:55:27+09:00",
  "updated_at": "2026-08-27T20:10:17+09:00",
  "record_hash": null
}
